{
  "id": "6f1c2e0a-3b7d-4c8e-9f10-1a2b3c4d5e6f",
  "remote_id": null,
  "kind": "single",
  "item_ids": ["0b9e8d7c-6a5b-4c3d-2e1f-0a9b8c7d6e5f"],
  "title": "Apple iPad Air 2 64GB Wi-Fi, Space Gray",
  "description": "Apple iPad Air 2, 64GB, Wi-Fi only, Space Gray. Works well, light scuffs on the back. No charger. Local pickup.",
  "price": 75,
  "bundle_discount": null,
  "status": "draft",
  "listed_at": null,
  "sold_at": null,
  "created_at": "2026-09-14T17:00:00Z",
  "updated_at": "2026-09-14T17:00:00Z"
}
